{
 "schemaVersion": 1,
 "packId": "pk-core",
 "packVersion": "2026.10.0-draft",
 "country": "PK",
 "status": "draft",
 "license": "Nutrition: USDA FoodData Central (public domain, CC0 1.0). Recipes and names: project content, draft.",
 "notice": "Draft data. Not reviewed by a nutrition professional. Release builds must not auto-plan with draft foods.",
 "measures": [
  {
   "id": "katori",
   "label": "Katori",
   "ur": "کٹوری",
   "description": "Small bowl used for salan and daal",
   "grams": 180
  },
  {
   "id": "half-katori",
   "label": "Half katori",
   "ur": "آدھی کٹوری",
   "description": "Half a small bowl",
   "grams": 90
  },
  {
   "id": "pyala",
   "label": "Pyala",
   "ur": "پیالہ",
   "description": "Tea cup",
   "ml": 180
  },
  {
   "id": "glass",
   "label": "Glass",
   "ur": "گلاس",
   "description": "Standard drinking glass",
   "ml": 250
  },
  {
   "id": "chamach",
   "label": "Chamach",
   "ur": "چمچ",
   "description": "Tablespoon",
   "grams": 15
  },
  {
   "id": "plate-rice",
   "label": "Plate of rice",
   "ur": "چاول کی پلیٹ",
   "description": "Level dinner plate portion",
   "grams": 200
  },
  {
   "id": "roti-small",
   "label": "Small roti",
   "ur": "چھوٹی روٹی",
   "description": "About 15 cm across",
   "grams": 40
  },
  {
   "id": "roti-medium",
   "label": "Medium roti",
   "ur": "درمیانی روٹی",
   "description": "About 20 cm across",
   "grams": 55
  },
  {
   "id": "roti-tandoori",
   "label": "Tandoori roti",
   "ur": "تندوری روٹی",
   "description": "From a tandoor, about 25 cm",
   "grams": 120
  }
 ],
 "ingredients": [
  {
   "id": "atta",
   "name": "Whole-wheat flour (atta)",
   "category": "grain",
   "origin": "plant",
   "allergens": [
    "gluten"
   ],
   "per100g": {
    "kcal": 340,
    "protein": 13.2,
    "fat": 2.5,
    "carbs": 72,
    "fibre": 10.7
   },
   "source": {
    "dataset": "USDA FoodData Central SR Legacy (2018-04)",
    "fdcId": 168893,
    "description": "Wheat flour, whole-grain (Includes foods for USDA's Food Distribution Program)"
   }
  },
  {
   "id": "maida",
   "name": "White flour (maida)",
   "category": "grain",
   "origin": "plant",
   "allergens": [
    "gluten"
   ],
   "per100g": {
    "kcal": 364,
    "protein": 10.3,
    "fat": 0.98,
    "carbs": 76.3,
    "fibre": 2.7
   },
   "source": {
    "dataset": "USDA FoodData Central SR Legacy (2018-04)",
    "fdcId": 168894,
    "description": "Wheat flour, white, all-purpose, enriched, bleached"
   }
  },
  {
   "id": "rice",
   "name": "White rice, long-grain, raw",
   "category": "grain",
   "origin": "plant",
   "allergens": [],
   "per100g": {
    "kcal": 365,
    "protein": 7.13,
    "fat": 0.66,
    "carbs": 80,
    "fibre": 1.3
   },
   "source": {
    "dataset": "USDA FoodData Central SR Legacy (2018-04)",
    "fdcId": 168877,
    "description": "Rice, white, long-grain, regular, raw, enriched"
   }
  },
  {
   "id": "semolina",
   "name": "Semolina (suji)",
   "category": "grain",
   "origin": "plant",
   "allergens": [
    "gluten"
   ],
   "per100g": {
    "kcal": 360,
    "protein": 12.7,
    "fat": 1.05,
    "carbs": 72.8,
    "fibre": 3.9
   },
   "source": {
    "dataset": "USDA FoodData Central SR Legacy (2018-04)",
    "fdcId": 169715,
    "description": "Semolina, enriched"
   }
  },
  {
   "id": "corn-flour",
   "name": "Corn flour, whole-grain (makki atta)",
   "category": "grain",
   "origin": "plant",
   "allergens": [],
   "per100g": {
    "kcal": 361,
    "protein": 6.93,
    "fat": 3.86,
    "carbs": 76.8,
    "fibre": 7.3
   },
   "source": {
    "dataset": "USDA FoodData Central SR Legacy (2018-04)",
    "fdcId": 170290,
    "description": "Corn flour, whole-grain, yellow"
   }
  },
  {
   "id": "besan",
   "name": "Chickpea flour (besan)",
   "category": "grain",
   "origin": "plant",
   "allergens": [],
   "per100g": {
    "kcal": 387,
    "protein": 22.4,
    "fat": 6.69,
    "carbs": 57.8,
    "fibre": 10.8
   },
   "source": {
    "dataset": "USDA FoodData Central SR Legacy (2018-04)",
    "fdcId": 174288,
    "description": "Chickpea flour (besan)"
   }
  },
  {
   "id": "bread-white",
   "name": "White bread",
   "category": "bakery",
   "origin": "plant",
   "allergens": [
    "gluten"
   ],
   "per100g": {
    "kcal": 266,
    "protein": 8.85,
    "fat": 3.33,
    "carbs": 49.4,
    "fibre": 2.7
   },
   "source": {
    "dataset": "USDA FoodData Central SR Legacy (2018-04)",
    "fdcId": 174924,
    "description": "Bread, white, commercially prepared (includes soft bread crumbs)"
   }
  },
  {
   "id": "rusk",
   "name": "Rusk (zwieback)",
   "category": "bakery",
   "origin": "plant",
   "allergens": [
    "gluten"
   ],
   "per100g": {
    "kcal": 426,
    "protein": 10.1,
    "fat": 9.7,
    "carbs": 74.2,
    "fibre": 2.5
   },
   "source": {
    "dataset": "USDA FoodData Central SR Legacy (2018-04)",
    "fdcId": 171372,
    "description": "Zwieback"
   }
  },
  {
   "id": "masoor",
   "name": "Red lentils (masoor), raw",
   "category": "legume",
   "origin": "plant",
   "allergens": [],
   "per100g": {
    "kcal": 358,
    "protein": 23.9,
    "fat": 2.17,
    "carbs": 63.1,
    "fibre": 10.8
   },
   "source": {
    "dataset": "USDA FoodData Central SR Legacy (2018-04)",
    "fdcId": 174284,
    "description": "Lentils, pink or red, raw"
   }
  },
  {
   "id": "moong",
   "name": "Mung beans (moong), raw",
   "category": "legume",
   "origin": "plant",
   "allergens": [],
   "per100g": {
    "kcal": 347,
    "protein": 23.9,
    "fat": 1.15,
    "carbs": 62.6,
    "fibre": 16.3
   },
   "source": {
    "dataset": "USDA FoodData Central SR Legacy (2018-04)",
    "fdcId": 174256,
    "description": "Mung beans, mature seeds, raw"
   }
  },
  {
   "id": "mash",
   "name": "Black gram (mash), raw",
   "category": "legume",
   "origin": "plant",
   "allergens": [],
   "per100g": {
    "kcal": 341,
    "protein": 25.2,
    "fat": 1.64,
    "carbs": 59,
    "fibre": 18.3
   },
   "source": {
    "dataset": "USDA FoodData Central SR Legacy (2018-04)",
    "fdcId": 174259,
    "description": "Mungo beans, mature seeds, raw"
   }
  },
  {
   "id": "chana",
   "name": "Chickpeas (chana), raw",
   "category": "legume",
   "origin": "plant",
   "allergens": [],
   "per100g": {
    "kcal": 378,
    "protein": 20.5,
    "fat": 6.04,
    "carbs": 63,
    "fibre": 12.2
   },
   "source": {
    "dataset": "USDA FoodData Central SR Legacy (2018-04)",
    "fdcId": 173756,
    "description": "Chickpeas (garbanzo beans, bengal gram), mature seeds, raw"
   }
  },
  {
   "id": "rajma",
   "name": "Red kidney beans (rajma), raw",
   "category": "legume",
   "origin": "plant",
   "allergens": [],
   "per100g": {
    "kcal": 337,
    "protein": 22.5,
    "fat": 1.06,
    "carbs": 61.3,
    "fibre": 15.2
   },
   "source": {
    "dataset": "USDA FoodData Central SR Legacy (2018-04)",
    "fdcId": 173744,
    "description": "Beans, kidney, red, mature seeds, raw"
   }
  },
  {
   "id": "chicken",
   "name": "Chicken, meat only, raw",
   "category": "meat",
   "origin": "meat",
   "allergens": [],
   "per100g": {
    "kcal": 119,
    "protein": 21.4,
    "fat": 3.08,
    "carbs": 0,
    "fibre": 0
   },
   "source": {
    "dataset": "USDA FoodData Central SR Legacy (2018-04)",
    "fdcId": 171052,
    "description": "Chicken, broilers or fryers, meat only, raw"
   }
  },
  {
   "id": "goat",
   "name": "Goat meat (mutton), raw",
   "category": "meat",
   "origin": "meat",
   "allergens": [],
   "per100g": {
    "kcal": 109,
    "protein": 20.6,
    "fat": 2.31,
    "carbs": 0,
    "fibre": 0
   },
   "source": {
    "dataset": "USDA FoodData Central SR Legacy (2018-04)",
    "fdcId": 175303,
    "description": "Game meat, goat, raw"
   }
  },
  {
   "id": "beef-mince",
   "name": "Beef mince, 90% lean, raw",
   "category": "meat",
   "origin": "meat",
   "allergens": [],
   "per100g": {
    "kcal": 176,
    "protein": 20,
    "fat": 10,
    "carbs": 0,
    "fibre": 0
   },
   "source": {
    "dataset": "USDA FoodData Central SR Legacy (2018-04)",
    "fdcId": 174030,
    "description": "Beef, ground, 90% lean meat / 10% fat, raw"
   }
  },
  {
   "id": "fish",
   "name": "Fish (carp), raw",
   "category": "fish",
   "origin": "fish",
   "allergens": [
    "fish"
   ],
   "per100g": {
    "kcal": 127,
    "protein": 17.8,
    "fat": 5.6,
    "carbs": 0,
    "fibre": 0
   },
   "source": {
    "dataset": "USDA FoodData Central SR Legacy (2018-04)",
    "fdcId": 171952,
    "description": "Fish, carp, raw"
   }
  },
  {
   "id": "egg",
   "name": "Egg, whole, raw",
   "category": "egg",
   "origin": "egg",
   "allergens": [
    "egg"
   ],
   "per100g": {
    "kcal": 143,
    "protein": 12.6,
    "fat": 9.51,
    "carbs": 0.72,
    "fibre": 0
   },
   "source": {
    "dataset": "USDA FoodData Central SR Legacy (2018-04)",
    "fdcId": 171287,
    "description": "Egg, whole, raw, fresh"
   }
  },
  {
   "id": "milk",
   "name": "Milk, whole",
   "category": "dairy",
   "origin": "dairy",
   "allergens": [
    "dairy"
   ],
   "per100g": {
    "kcal": 61,
    "protein": 3.15,
    "fat": 3.27,
    "carbs": 4.78,
    "fibre": 0
   },
   "source": {
    "dataset": "USDA FoodData Central SR Legacy (2018-04)",
    "fdcId": 172217,
    "description": "Milk, whole, 3.25% milkfat, without added vitamin A and vitamin D"
   }
  },
  {
   "id": "yogurt",
   "name": "Yogurt (dahi), plain, whole milk",
   "category": "dairy",
   "origin": "dairy",
   "allergens": [
    "dairy"
   ],
   "per100g": {
    "kcal": 61,
    "protein": 3.47,
    "fat": 3.25,
    "carbs": 4.66,
    "fibre": 0
   },
   "source": {
    "dataset": "USDA FoodData Central SR Legacy (2018-04)",
    "fdcId": 171284,
    "description": "Yogurt, plain, whole milk"
   }
  },
  {
   "id": "ghee",
   "name": "Ghee (clarified butter)",
   "category": "fat",
   "origin": "dairy",
   "allergens": [
    "dairy"
   ],
   "per100g": {
    "kcal": 900,
    "protein": 0,
    "fat": 100,
    "carbs": 0,
    "fibre": 0
   },